{
  "seed": "7c9e4a2f8b1d6e03",
  "epoch": 0,
  "generator": {
    "name": "mapforge",
    "version": "3.0.0"
  },
  "cellKm": 0.5,
  "grid": {
    "w": 800,
    "h": 800,
    "cells": 640000
  },
  "seaLevel": 0.04,
  "rank": 262400,
  "census": {
    "grossLandCells": 262400,
    "lakeCells": 6400,
    "seaCells": 377600,
    "unownedLandCells": 0
  },
  "areaKm2": {
    "netLand": 64000,
    "water": 96000,
    "total": 160000
  },
  "seaToLandRatio": 1.5,
  "continents": [
    {"id":"c01","landCells":23989,"grossLandKm2":5997.25,"fabric":"content/world/fabric/continent-01.json"},
    {"id":"c02","landCells":48411,"grossLandKm2":12102.75,"fabric":"content/world/fabric/continent-02.json"},
    {"id":"c03","landCells":44038,"grossLandKm2":11009.5,"fabric":"content/world/fabric/continent-03.json"},
    {"id":"c04","landCells":45191,"grossLandKm2":11297.75,"fabric":"content/world/fabric/continent-04.json"},
    {"id":"c05","landCells":43995,"grossLandKm2":10998.75,"fabric":"content/world/fabric/continent-05.json"},
    {"id":"c06","landCells":12797,"grossLandKm2":3199.25,"fabric":"content/world/fabric/continent-06.json"},
    {"id":"c07","landCells":12000,"grossLandKm2":3000,"fabric":"content/world/fabric/continent-07.json"},
    {"id":"c08","landCells":11988,"grossLandKm2":2997,"fabric":"content/world/fabric/continent-08.json"},
    {"id":"c09","landCells":3998,"grossLandKm2":999.5,"fabric":"content/world/fabric/continent-09.json"},
    {"id":"c10","landCells":3999,"grossLandKm2":999.75,"fabric":"content/world/fabric/continent-10.json"},
    {"id":"c11","landCells":3997,"grossLandKm2":999.25,"fabric":"content/world/fabric/continent-11.json"},
    {"id":"c12","landCells":3998,"grossLandKm2":999.5,"fabric":"content/world/fabric/continent-12.json"},
    {"id":"c13","landCells":3999,"grossLandKm2":999.75,"fabric":"content/world/fabric/continent-13.json"}
  ],
  "seaLanes": [
    {"id":"lane-01","from":"c-town-gildmark","to":"c-town-netstead","km":246.29,"points":[[83.2,160.4],[113.25,189.75],[113.75,190.25],[114.25,190.75],[114.75,191.25],[115.25,191.75],[115.75,192.25],[116.25,192.75],[116.75,193.25],[117.25,193.75],[117.75,194.25],[118.25,194.75],[118.75,195.25],[119.25,195.75],[119.75,196.25],[120.25,196.75],[120.75,196.75],[121.25,197.25],[121.75,197.75],[122.25,198.25],[122.75,198.75],[123.25,199.25],[123.75,199.75],[124.25,200.25],[124.75,200.75],[125.25,201.25],[125.75,201.75],[126.25,202.25],[126.75,202.75],[127.25,203.25],[127.75,203.75],[128.25,204.25],[128.75,204.75],[129.25,205.25],[129.75,205.75],[130.25,206.25],[130.75,206.75],[131.25,207.25],[131.75,207.75],[132.25,208.25],[132.75,208.75],[133.25,209.25],[133.75,209.75],[134.25,210.25],[134.75,210.75],[135.25,211.25],[135.75,211.75],[136.25,212.25],[136.75,212.75],[137.25,213.25],[137.75,213.75],[138.25,214.25],[138.75,214.75],[139.25,215.25],[139.75,215.75],[140.25,216.25],[140.75,216.75],[141.25,217.25],[141.75,217.75],[142.25,218.25],[142.75,218.75],[143.25,219.25],[143.75,219.75],[144.25,220.25],[144.75,220.75],[145.25,221.25],[145.75,221.75],[146.25,222.25],[146.75,222.75],[147.25,223.25],[147.75,223.75],[148.25,224.25],[148.75,224.75],[149.25,225.25],[149.75,225.75],[150.25,226.25],[150.75,226.75],[151.25,227.25],[151.75,227.75],[152.25,228.25],[152.75,228.75],[153.25,229.25],[153.75,229.75],[154.25,230.25],[154.75,230.75],[155.25,231.25],[155.75,231.75],[156.25,232.25],[156.75,232.75],[157.25,233.25],[157.75,233.75],[158.25,234.25],[158.75,234.75],[159.25,235.25],[159.75,235.75],[160.25,235.75],[160.75,235.75],[161.25,235.75],[161.75,235.75],[162.25,235.75],[162.75,235.75],[163.25,235.75],[163.75,235.75],[164.25,235.75],[164.75,235.75],[165.25,235.75],[165.75,235.75],[166.25,235.75],[166.75,235.75],[167.25,235.75],[167.75,235.75],[168.25,235.75],[168.75,235.75],[169.25,235.75],[169.75,235.75],[170.25,235.75],[170.75,235.75],[171.25,235.75],[171.75,235.75],[172.25,235.75],[172.75,235.75],[173.25,235.75],[173.75,235.75],[174.25,235.75],[174.75,235.75],[175.25,235.75],[175.75,235.75],[176.25,235.75],[176.75,235.75],[177.25,235.75],[177.75,235.75],[178.25,235.75],[178.75,235.75],[179.25,235.75],[179.75,235.75],[180.25,235.75],[180.75,235.75],[181.25,235.75],[181.75,235.75],[182.25,235.75],[182.75,235.75],[183.25,235.75],[183.75,235.75],[184.25,235.75],[184.75,235.75],[185.25,235.75],[185.75,235.75],[186.25,235.75],[186.75,235.75],[187.25,235.75],[187.75,235.75],[188.25,235.75],[188.75,235.75],[189.25,235.75],[189.75,235.75],[190.25,235.75],[190.75,235.75],[191.25,235.75],[191.75,235.75],[192.25,235.75],[192.75,235.75],[193.25,235.75],[193.75,235.75],[194.25,235.75],[194.75,235.75],[195.25,235.75],[195.75,235.75],[196.25,235.75],[196.75,235.75],[197.25,235.75],[197.75,235.75],[198.25,235.75],[198.75,235.75],[199.25,235.75],[199.75,235.75],[200.25,235.75],[200.75,235.75],[201.25,235.75],[201.75,235.75],[202.25,235.75],[202.75,236.25],[203.25,236.75],[203.75,237.25],[204.25,237.75],[204.75,238.25],[205.25,238.75],[205.75,239.25],[206.25,239.75],[206.75,240.25],[207.25,240.75],[207.75,241.25],[208.25,241.75],[208.75,242.25],[209.25,242.75],[209.75,243.25],[210.25,243.75],[210.75,244.25],[211.25,244.75],[211.75,245.25],[212.25,245.75],[212.75,246.25],[213.25,246.75],[213.75,247.25],[214.25,247.75],[214.75,248.25],[215.25,248.25],[215.75,248.75],[216.25,249.25],[216.75,249.25],[217.25,249.75],[217.75,250.25],[218.25,250.25],[218.75,250.75],[219.25,250.75],[219.75,251.25],[220.25,251.75],[220.75,251.75],[221.25,252.25],[221.75,252.75],[222.25,252.75],[222.75,252.75],[223.25,252.75],[223.75,252.75],[224.25,252.75],[224.75,252.75],[225.25,252.75],[225.75,253.25],[226.25,253.75],[226.75,254.25],[227.25,254.75],[227.75,255.25],[228.25,255.75],[228.75,256.25],[229.25,256.75],[229.75,257.25],[230.25,257.75],[230.75,258.25],[231.25,258.75],[231.75,259.25],[232.25,259.75],[232.75,260.25],[233.25,260.75],[233.75,261.25],[234.25,261.75],[234.75,262.25],[235.25,262.75],[235.75,263.25],[236.25,263.75],[236.75,264.25],[237.25,264.75],[237.75,265.25],[238.25,265.75],[238.75,266.25],[239.25,266.75],[239.75,267.25],[240.25,267.75],[240.75,268.25],[241.25,268.75],[241.75,268.75],[242.25,269.25],[242.75,269.75],[243.25,270.25],[243.75,270.75],[244.25,271.25],[244.75,271.75],[245.25,272.25],[245.75,272.75],[246.25,273.25],[246.75,273.75],[247.25,274.25],[247.75,274.75],[248.25,275.25],[248.75,275.75],[249.25,276.25],[249.75,276.75],[250.25,277.25],[250.75,277.75],[251.25,278.25],[251.75,278.25],[252.25,278.25],[252.75,278.25],[253.25,278.25],[253.75,278.25],[254.25,278.25],[254.75,278.25],[255.25,278.25],[255.75,278.25],[256.25,278.25],[256.75,278.25],[257.25,278.25],[257.75,278.25],[258.25,278.25],[274,262]]},